{"_D":"urn:oasis:names:specification:ubl:schema:xsd:OrderChange-2",
 "_A":"urn:oasis:names:specification:ubl:schema:xsd:CommonAggregateComponents-2",
 "_B":"urn:oasis:names:specification:ubl:schema:xsd:CommonBasicComponents-2",
 "OrderChange":{
 "UBLVersionID":{"_":"2.1"},
 "CustomizationID":{"_":"urn:www.cenbii.eu:transaction:biicoretrdmXYZ:ver1.0"},
 "ProfileID":{"_":"urn:www.cenbii.eu:profile:BIIXYZ:ver1.0",
  "schemeAgencyID":"BII",
  "schemeID":"Profile"},
 "ID":{"_":"7"},
 "IssueDate":{"_":"2010-01-21"},
 "IssueTime":{"_":"12:30:00Z"},
 "SequenceNumberID":{"_":"1"},
 "Note":[{"_":"Information text for the whole order change"}],
 "OrderReference":{
  "ID":{"_":"34"}
 },
 "BuyerCustomerParty":{
  "Party":{
   "EndpointID":{"_":"7300072311115",
    "schemeAgencyID":"9",
    "schemeID":"GLN"},
   "PartyIdentification":[{
    "ID":{"_":"7300070011115",
     "schemeAgencyID":"9",
     "schemeID":"GLN"}
   },{
    "ID":{"_":"PartyID123"}
   }],
   "PartyName":[{
    "Name":{"_":"Johnssons byggvaror"}
   }]
  }
 },
 "SellerSupplierParty":{
  "Party":{
   "EndpointID":{"_":"7302347231111",
    "schemeAgencyID":"9",
    "schemeID":"GLN"},
   "PartyIdentification":[{
    "ID":{"_":"SellerPartyID123"}
   }],
   "PartyName":[{
    "Name":{"_":"Moderna Produkter AB"}
   }]
  }
 },
 "OrderLine":[{
  "Note":[{"_":"Freetext note on line 1"}],
  "LineItem":{
   "ID":{"_":"1"},
   "LineStatusCode":{"_":"Revised",
    "listAgencyID":"UBL",
    "listName":"Line Status"},
   "Quantity":{"_":240,
    "unitCode":"LTR"},
   "LineExtensionAmount":{"_":12000,
    "currencyID":"SEK"},
   "TotalTaxAmount":{"_":20,
    "currencyID":"SEK"},
   "PartialDeliveryIndicator":{"_":false},
   "AccountingCostCode":{"_":"ProjectID123"},
   "Delivery":[{
    "RequestedDeliveryPeriod":{
     "StartDate":{"_":"2010-02-10"},
     "EndDate":{"_":"2010-02-25"}
    }
   }],
   "OriginatorParty":{
    "PartyIdentification":[{
     "ID":{"_":"EmployeeXXX",
      "schemeAgencyID":"ZZZ",
      "schemeID":"ZZZ"}
    }],
    "PartyName":[{
     "Name":{"_":"Josef K."}
    }]
   },
   "Price":{
    "PriceAmount":{"_":50,
     "currencyID":"SEK"},
    "BaseQuantity":{"_":1,
     "unitCode":"LTR"}
   },
   "Item":{
    "Description":[{"_":"Red paint"}],
    "Name":{"_":"Falu Rödfärg"},
    "SellersItemIdentification":{
     "ID":{"_":"SItemNo001"}
    },
    "StandardItemIdentification":{
     "ID":{"_":"1234567890123",
      "schemeAgencyID":"6",
      "schemeID":"GTIN"}
    },
    "AdditionalItemProperty":[{
     "Name":{"_":"Paint type"},
     "Value":{"_":"Acrylic"}
    },{
     "Name":{"_":"Solvant"},
     "Value":{"_":"Water"}
    }]
   }
  }
 }]
}}